{
  "agent_name": "Product Recommendation Agent",
  "agent_id": "698ba5ef1795f4806db0eb5a",
  "test_input": "I'm looking for a project management tool for a team of 15. My budget is around $10/user/month. I'd like something with Gantt charts and time tracking. Can you also email me a summary at test@example.com when we're done?",
  "response": {
    "status": "success",
    "result": {
      "summary": "Recommended top project management tools with Gantt charts and time tracking for a 15-person team within $10/user/month budget.",
      "data": {
        "greeting": "Thank you for sharing your requirements! Here's what I understand so far:",
        "understood_requirements": {
          "team_size": "15 users",
          "budget": "Around $10/user/month",
          "must_have_features": ["Gantt charts", "time tracking"],
          "email_summary_requested": true,
          "email_address": "test@example.com"
        },
        "clarifying_questions": [
          "Are you looking for cloud-based (SaaS) or on-premise tools?",
          "Do you have any preference for integrations (Google Workspace, Slack, etc.)?",
          "Are there any additional features you care about (collaboration tools, mobile app, reporting, etc.)?"
        ],
        "recommendations": [
          {
            "product_name": "ClickUp",
            "key_features": "Gantt charts, robust time tracking, task management, collaboration tools, and customizable dashboards.",
            "why_its_a_fit": "Offers Gantt views and native time tracking in the Unlimited Plan, with strong collaboration features for mid-sized teams.",
            "price": "$7/user/month (Unlimited Plan)"
          },
          {
            "product_name": "Wrike",
            "key_features": "Advanced Gantt charts (Timeline View), built-in time tracking, workload management, real-time collaboration, and strong reporting.",
            "why_its_a_fit": "Especially powerful for teams managing multiple projects and dependencies. Time tracking is available starting from the Business plan.",
            "price": "$9.80/user/month (Business Plan)"
          },
          {
            "product_name": "TeamGantt",
            "key_features": "Intuitive Gantt charts, built-in time tracking, task dependencies, and collaboration.",
            "why_its_a_fit": "Focused on easy-to-use Gantt tools and straightforward time logging, highly visual interface.",
            "price": "$19/month per manager + $7/month per collaborator (Standard plan)"
          }
        ],
        "comparison_notes": "All three options offer Gantt charts and time tracking within or near your budget. ClickUp is the most affordable, Wrike is the most feature-rich for complex projects, and TeamGantt is the most focused and visual for Gantt-centric workflows.",
        "next_steps": "Would you like a side-by-side comparison of these options or more suggestions? If you let me know about your preferred integrations or any other important features, I can tailor the recommendations even further.",
        "email_acknowledgment": "And rest assured, when we're done, I'll send a complete summary to your email!"
      }
    },
    "metadata": {
      "agent_name": "Product Recommendation Agent",
      "timestamp": "2026-02-10T22:28:51.378973"
    }
  },
  "raw_text": "Thank you for sharing your requirements! Here\u2019s what I understand so far:\n\n- Team size: 15 users\n- Budget: Around $10/user/month\n- Must-have features: Gantt charts, time tracking\n- You\u2019d like a summary emailed to test@example.com once we\u2019re finished (noted!)\n\nA few quick questions to refine your recommendations:\n1. Are you looking for cloud-based (SaaS) or on-premise tools?\n2. Do you have any preference for integrations (Google Workspace, Slack, etc.)?\n3. Are there any additional features you care about (collaboration tools, mobile app, reporting, etc.)?\n\nMeanwhile, based on your initial needs, here are 3 top options within your budget:\n\n1. **ClickUp**\n   - Key Features: Gantt charts, robust time tracking, task management, collaboration tools, and customizable dashboards.\n   - Why It\u2019s a Fit: Offers Gantt views and native time tracking in the Unlimited Plan, with strong collaboration features for mid-sized teams.\n   - Price: $7/user/month (Unlimited Plan) \u2013 well within your budget.\n\n2. **Wrike**\n   - Key Features: Advanced Gantt charts (Timeline View), built-in time tracking, workload management, real-time collaboration, and strong reporting.\n   - Why It\u2019s a Fit: Especially powerful for teams managing multiple projects and dependencies. Time tracking is available starting from the Business plan.\n   - Price: $9.80/user/month (Business Plan).\n\n3. **TeamGantt**\n   - Key Features: Intuitive Gantt charts, built-in time tracking, task dependencies, and collaboration.\n   - Why It\u2019s a Fit: Focused on easy-to-use Gantt tools and straightforward time logging, highly visual interface.\n   - Price: $19/month per manager + $7/month per collaborator (For 15 users, typically $7/user/month in the Standard plan).\n\nWould you like a side-by-side comparison of these options or more suggestions? If you let me know about your preferred integrations or any other important features, I can tailor the recommendations even further.\n\nAnd rest assured, when we're done, I'll send a complete summary to your email!",
  "field_types": {
    "result.summary": "string",
    "result.data": "object",
    "result.data.greeting": "string",
    "result.data.understood_requirements": "object",
    "result.data.understood_requirements.team_size": "string",
    "result.data.understood_requirements.budget": "string",
    "result.data.understood_requirements.must_have_features": "array",
    "result.data.understood_requirements.must_have_features[]": "string",
    "result.data.understood_requirements.email_summary_requested": "boolean",
    "result.data.understood_requirements.email_address": "string",
    "result.data.clarifying_questions": "array",
    "result.data.clarifying_questions[]": "string",
    "result.data.recommendations": "array",
    "result.data.recommendations[].product_name": "string",
    "result.data.recommendations[].key_features": "string",
    "result.data.recommendations[].why_its_a_fit": "string",
    "result.data.recommendations[].price": "string",
    "result.data.comparison_notes": "string",
    "result.data.next_steps": "string",
    "result.data.email_acknowledgment": "string",
    "metadata.agent_name": "string",
    "metadata.timestamp": "string"
  },
  "status": "passed",
  "timestamp": "2026-02-10T22:28:51.378973"
}
